{"schema_version":"1.0.0","content_version":"1.0.0","updated_at":"2026-08-24T00:00:00+09:00","normative_status":"operational-source-of-truth","comparison_form_persistence":false,"profiles":[
{"id":"meaning-default","input_kind":"text","ordered_steps":["unicode-nfc"],"unicode_normalization":"NFC","case_handling":"fold","outer_space":"trim","internal_space":"collapse","punctuation":"remove-nonscored","apostrophes":"remove-if-nonscored","macrons":"fold","i_j":"fold-to-i","u_v":"fold-to-u","preserve_other_letters":true},
{"id":"morphology-default","input_kind":"text","ordered_steps":["unicode-nfc"],"unicode_normalization":"NFC","case_handling":"fold","outer_space":"trim","internal_space":"collapse","punctuation":"remove-nonscored","apostrophes":"remove-if-nonscored","macrons":"fold","i_j":"fold-to-i","u_v":"fold-to-u","preserve_other_letters":true},
{"id":"macron-sensitive","input_kind":"text","ordered_steps":["unicode-nfc"],"unicode_normalization":"NFC","case_handling":"fold","outer_space":"trim","internal_space":"collapse","punctuation":"remove-nonscored","apostrophes":"remove-if-nonscored","macrons":"preserve","i_j":"fold-to-i","u_v":"fold-to-u","preserve_other_letters":true},
{"id":"orthography-strict","input_kind":"text","ordered_steps":["unicode-nfc"],"unicode_normalization":"NFC","case_handling":"preserve","outer_space":"preserve","internal_space":"preserve","punctuation":"preserve","apostrophes":"preserve","macrons":"preserve","i_j":"preserve","u_v":"preserve","preserve_other_letters":true},
{"id":"structured-features","input_kind":"structured","ordered_steps":["compare-feature-object"],"unicode_normalization":"NFC","case_handling":"not-applicable","outer_space":"not-applicable","internal_space":"not-applicable","punctuation":"not-applicable","apostrophes":"not-applicable","macrons":"not-applicable","i_j":"not-applicable","u_v":"not-applicable","preserve_other_letters":true}]}
